{
  "$schema": "../../schemas/animation_clip.schema.json",
  "id": "anim_death",
  "name": "Death",
  "description": "Death animation - character falls backward",
  "version": "1.0",
  "duration": 2.0,
  "frameRate": 30,
  "looping": false,
  "playbackSpeed": 1.0,
  "skeleton": "humanoid_standard",

  "bones": {
    "Root": {
      "enabled": true,
      "interpolation": "bezier",
      "keyframes": [
        { "time": 0.0, "position": [0, 0, 0], "rotation": [0, 0, 0, 1] },
        { "time": 0.3, "position": [0, 0.1, -0.1], "rotation": [-0.1, 0, 0, 0.995] },
        { "time": 0.8, "position": [0, 0.3, -0.5], "rotation": [-0.3, 0, 0, 0.9539] },
        { "time": 1.2, "position": [0, 0.15, -0.8], "rotation": [-0.5, 0, 0, 0.866] },
        { "time": 1.6, "position": [0, 0, -1.0], "rotation": [-0.7071, 0, 0, 0.7071] },
        { "time": 2.0, "position": [0, 0, -1.0], "rotation": [-0.7071, 0, 0, 0.7071] }
      ]
    },
    "Spine": {
      "enabled": true,
      "interpolation": "bezier",
      "keyframes": [
        { "time": 0.0, "rotation": [0, 0, 0, 1] },
        { "time": 0.3, "rotation": [0.15, 0, 0.05, 0.9875] },
        { "time": 0.8, "rotation": [0.2, 0, 0.08, 0.9763] },
        { "time": 1.2, "rotation": [0.1, 0, 0.03, 0.9945] },
        { "time": 2.0, "rotation": [0.05, 0, 0, 0.9987] }
      ]
    },
    "Spine1": {
      "enabled": true,
      "interpolation": "bezier",
      "keyframes": [
        { "time": 0.0, "rotation": [0, 0, 0, 1] },
        { "time": 0.3, "rotation": [0.1, 0, 0.03, 0.9945] },
        { "time": 0.8, "rotation": [0.15, 0, 0.05, 0.9875] },
        { "time": 2.0, "rotation": [0.03, 0, 0, 0.9996] }
      ]
    },
    "Neck": {
      "enabled": true,
      "interpolation": "bezier",
      "keyframes": [
        { "time": 0.0, "rotation": [0, 0, 0, 1] },
        { "time": 0.3, "rotation": [-0.2, 0, 0.05, 0.9783] },
        { "time": 0.8, "rotation": [-0.3, 0, 0.08, 0.9503] },
        { "time": 1.6, "rotation": [-0.15, 0.1, 0.05, 0.9825] },
        { "time": 2.0, "rotation": [-0.1, 0.08, 0.03, 0.9916] }
      ]
    },
    "Head": {
      "enabled": true,
      "interpolation": "bezier",
      "keyframes": [
        { "time": 0.0, "rotation": [0, 0, 0, 1] },
        { "time": 0.3, "rotation": [-0.15, 0.05, 0, 0.9875] },
        { "time": 0.8, "rotation": [-0.25, 0.1, 0.05, 0.9617] },
        { "time": 1.6, "rotation": [-0.1, -0.15, 0.08, 0.9797] },
        { "time": 2.0, "rotation": [-0.05, -0.1, 0.05, 0.9925] }
      ]
    },
    "LeftArm": {
      "enabled": true,
      "interpolation": "bezier",
      "keyframes": [
        { "time": 0.0, "rotation": [0.05, 0, 0.1, 0.9937] },
        { "time": 0.3, "rotation": [0.3, 0.1, 0.4, 0.8573] },
        { "time": 0.8, "rotation": [0.4, 0.15, 0.5, 0.7483] },
        { "time": 1.6, "rotation": [0.2, 0.05, 0.6, 0.7714] },
        { "time": 2.0, "rotation": [0.1, 0, 0.55, 0.8283] }
      ]
    },
    "LeftForeArm": {
      "enabled": true,
      "interpolation": "bezier",
      "keyframes": [
        { "time": 0.0, "rotation": [0, 0, 0, 1] },
        { "time": 0.3, "rotation": [-0.3, 0, 0, 0.9539] },
        { "time": 0.8, "rotation": [-0.5, 0, 0, 0.866] },
        { "time": 2.0, "rotation": [-0.2, 0, 0, 0.9798] }
      ]
    },
    "RightArm": {
      "enabled": true,
      "interpolation": "bezier",
      "keyframes": [
        { "time": 0.0, "rotation": [0.05, 0, -0.1, 0.9937] },
        { "time": 0.3, "rotation": [0.3, -0.1, -0.4, 0.8573] },
        { "time": 0.8, "rotation": [0.4, -0.15, -0.5, 0.7483] },
        { "time": 1.6, "rotation": [0.2, -0.05, -0.6, 0.7714] },
        { "time": 2.0, "rotation": [0.1, 0, -0.55, 0.8283] }
      ]
    },
    "RightForeArm": {
      "enabled": true,
      "interpolation": "bezier",
      "keyframes": [
        { "time": 0.0, "rotation": [0, 0, 0, 1] },
        { "time": 0.3, "rotation": [-0.3, 0, 0, 0.9539] },
        { "time": 0.8, "rotation": [-0.5, 0, 0, 0.866] },
        { "time": 2.0, "rotation": [-0.2, 0, 0, 0.9798] }
      ]
    },
    "LeftUpLeg": {
      "enabled": true,
      "interpolation": "bezier",
      "keyframes": [
        { "time": 0.0, "rotation": [0, 0, 0, 1] },
        { "time": 0.3, "rotation": [-0.1, 0, 0.05, 0.9937] },
        { "time": 0.8, "rotation": [-0.2, 0, 0.08, 0.9763] },
        { "time": 1.6, "rotation": [0.1, 0, 0.1, 0.99] },
        { "time": 2.0, "rotation": [0.05, 0, 0.08, 0.9956] }
      ]
    },
    "LeftLeg": {
      "enabled": true,
      "interpolation": "bezier",
      "keyframes": [
        { "time": 0.0, "rotation": [0, 0, 0, 1] },
        { "time": 0.8, "rotation": [0.3, 0, 0, 0.9539] },
        { "time": 2.0, "rotation": [0.15, 0, 0, 0.9887] }
      ]
    },
    "RightUpLeg": {
      "enabled": true,
      "interpolation": "bezier",
      "keyframes": [
        { "time": 0.0, "rotation": [0, 0, 0, 1] },
        { "time": 0.3, "rotation": [-0.1, 0, -0.05, 0.9937] },
        { "time": 0.8, "rotation": [-0.2, 0, -0.08, 0.9763] },
        { "time": 1.6, "rotation": [0.1, 0, -0.1, 0.99] },
        { "time": 2.0, "rotation": [0.05, 0, -0.08, 0.9956] }
      ]
    },
    "RightLeg": {
      "enabled": true,
      "interpolation": "bezier",
      "keyframes": [
        { "time": 0.0, "rotation": [0, 0, 0, 1] },
        { "time": 0.8, "rotation": [0.3, 0, 0, 0.9539] },
        { "time": 2.0, "rotation": [0.15, 0, 0, 0.9887] }
      ]
    }
  },

  "events": [
    { "name": "DeathStart", "time": 0.0, "function": "OnDeathStart" },
    { "name": "DeathGrunt", "time": 0.1, "function": "PlaySound", "parameter": "death_grunt" },
    { "name": "DropWeapon", "time": 0.4, "function": "OnDropWeapon" },
    { "name": "BodyImpact", "time": 1.6, "function": "OnBodyImpact" },
    { "name": "ImpactSound", "time": 1.6, "function": "PlaySound", "parameter": "body_fall" },
    { "name": "DeathComplete", "time": 2.0, "function": "OnDeathComplete" }
  ],

  "rootMotion": {
    "enabled": true,
    "extractPosition": { "x": false, "y": true, "z": true },
    "extractRotation": { "x": true, "y": false, "z": false },
    "rootBone": "Root",
    "lockY": false
  },

  "blending": {
    "blendInTime": 0.1,
    "blendOutTime": 0,
    "blendMode": "override"
  },

  "metadata": {
    "author": "Animation Team",
    "tags": ["death", "one_shot", "ragdoll_transition"]
  }
}
